{
  "schemaVersion": 1,
  "command": "run",
  "report": {
    "schemaVersion": 1,
    "tool": {
      "name": "smarttest",
      "version": "0.8.0"
    },
    "runId": "run_mvurykcq_fhbf",
    "command": "run --affected",
    "startedAt": "2026-10-30T09:33:30.122Z",
    "finishedAt": "2026-10-30T09:33:30.531Z",
    "project": "fixture-ts-lib-vitest",
    "mode": "balanced",
    "change": {
      "description": "git · HEAD…working tree",
      "changeSet": {
        "provider": "git",
        "changes": [
          {
            "type": "modified",
            "path": "src/core/Labeler.ts"
          }
        ],
        "completeness": "complete",
        "warnings": [],
        "baseRevision": "HEAD",
        "targetRevision": "working-tree"
      }
    },
    "decision": {
      "selectedTests": [
        {
          "testId": "test/labeler.test.ts",
          "filePath": "test/labeler.test.ts",
          "reasons": [
            {
              "kind": "transitive-dependency",
              "message": "Transitively depends on src/core/Labeler.ts (2 hops)",
              "path": ["src/core/Labeler.ts", "src/index.ts", "test/labeler.test.ts"],
              "confidence": "high"
            }
          ]
        },
        {
          "testId": "test/strings.test.ts",
          "filePath": "test/strings.test.ts",
          "reasons": [
            {
              "kind": "transitive-dependency",
              "message": "Transitively depends on src/core/Labeler.ts (2 hops)",
              "path": ["src/core/Labeler.ts", "src/index.ts", "test/strings.test.ts"],
              "confidence": "high"
            }
          ]
        }
      ],
      "skippedTests": [
        {
          "testId": "test/cache.test.ts",
          "filePath": "test/cache.test.ts",
          "reasons": [
            "No static dependency path from changed code",
            "No mandatory trigger matched",
            "No rule requires it"
          ],
          "confidence": "Limited to the analysed dependency model (0 file(s) with unresolved imports in its dependencies)"
        },
        {
          "testId": "test/numbers.test.ts",
          "filePath": "test/numbers.test.ts",
          "reasons": [
            "No static dependency path from changed code",
            "No mandatory trigger matched",
            "No rule requires it"
          ],
          "confidence": "Limited to the analysed dependency model (0 file(s) with unresolved imports in its dependencies)"
        }
      ],
      "affectedFiles": [
        "src/core/Labeler.ts",
        "src/index.ts",
        "test/labeler.test.ts",
        "test/strings.test.ts"
      ],
      "affectedSymbols": [
        "src/core/Labeler.ts#Labeler",
        "src/core/Labeler.ts#Labeler.@init",
        "src/core/Labeler.ts#Labeler.cache",
        "src/core/Labeler.ts#Labeler.label"
      ],
      "analysisStatus": "partial",
      "safetyMode": "balanced",
      "requestedMode": "balanced",
      "reasons": [],
      "warnings": [],
      "fallbackApplied": false
    },
    "executions": [
      {
        "file": "test/labeler.test.ts",
        "adapter": "vitest",
        "status": "passed",
        "durationMs": 1.3670359999999988,
        "tests": [
          {
            "testId": "test/labeler.test.ts::labels and caches",
            "status": "passed",
            "durationMs": 1.3670359999999988,
            "attempts": 1
          }
        ]
      },
      {
        "file": "test/strings.test.ts",
        "adapter": "vitest",
        "status": "passed",
        "durationMs": 1.4873210000000086,
        "tests": [
          {
            "testId": "test/strings.test.ts::capitalizes",
            "status": "passed",
            "durationMs": 1.2796930000000089,
            "attempts": 1
          },
          {
            "testId": "test/strings.test.ts::kebab-cases",
            "status": "passed",
            "durationMs": 0.2076279999999997,
            "attempts": 1
          }
        ]
      }
    ],
    "summary": {
      "totalTests": 4,
      "selected": 2,
      "executed": 2,
      "skippedBySelection": 2,
      "passed": 3,
      "failed": 0,
      "flaky": 0,
      "timedOut": 0,
      "cancelled": 0,
      "infrastructureErrors": 0,
      "skippedByTests": 0,
      "cached": 0,
      "durationMs": 401.3506839999999
    },
    "timings": {
      "change detection": 22.793616999999983,
      "index update": 43.252999999999986,
      "graph build": 1.1252429999999833,
      "semantic diff": 4.9755150000000015,
      "impact analysis": 1.672487999999987,
      "test execution": 327.53082099999995,
      "reports": 0.7765650000000051
    },
    "warnings": []
  },
  "reports": {
    "json": "/workspace/fixture/.smarttest/reports/report.json",
    "html": "/workspace/fixture/.smarttest/reports/report.html"
  },
  "integrityIssues": []
}
